{
  "formatVersion": 1,
  "contractVersion": 1,
  "generation": "743a8c36be6176d5f1df165ffb48dec7f90da7a33bfd24cc97f6cf8197d3aa01",
  "snapshotDigest": "1a2bd8ddb000ca54bda76802b642580742ad24741006b1d4e6f59f52fa9847b6",
  "catalogDigest": "0232f9b036849e2b9423d5960dd32f22001c79b5b6b6696330f481d1d0c657e0",
  "actionCatalogDigest": "72e063a5476308cefdd2771367ffeed9a8e553b3a2d7141f4e08c3e105a5deb2",
  "revision": "0",
  "targetHyprland": "0.56.1",
  "compatibleHyprland": {
    "major": 0,
    "minor": 56,
    "reviewedVersion": "0.56.1",
    "minimumPatch": 0,
    "maximumPatch": null
  },
  "rendererVersion": 1,
  "activationNonce": "0123456789abcdef0123456789abcdef",
  "createdAt": "2026-08-09T00:00:00Z",
  "entrypoint": "hyprland.lua",
  "files": {
    "hyprland.lua": {
      "sha256": "e3b0c44298fc1c149afbf4c8996fb92427ae41e4649b934ca495991b7852b855",
      "size": 0
    }
  }
}
